#,INEP,ESCOLA,MUNICÍPIO,LOGRADOURO,CEP,Velocidade Link
459,25072129,EEEFM SAO SEBASTIAO,Campina Grande,"RUA ESTELITA CRUZ, 307 - ALTO BRANCO",58401470,200Mbits
460,25050486,EEEFM FELIX DALTRO,Taperoá,"PRACA JOAO PESSOA, 200 - CENTRO",58680000,200Mbits
461,25090879,EEEFM ENG JOSE DAVILA LINS,Bayeux,"RUA ENGENHEIRO DE CARVALHO, SN - CENTRO",58110020,200Mbits
462,25062670,EEEF DE DEMONSTRACAO ALAGOA GRANDE,Alagoa Grande,"RUA RUI BARBOSA, SN - CENTRO",58388000,200Mbits
463,25092871,CENTRO PROFIS DEP ANTONIO CABRAL,João Pessoa,"AVENIDA AVELINA DOS SANTOS, SN - VALENTINA DE FIGUEIREDO",58064550,200Mbits
464,25094793,EEEFM SANTOS DUMONT,João Pessoa,"RUA DAS INDUSTRIAS, SN - DAS INDUSTRIAS",58083050,200Mbits
465,25033204,ECI EEM JOSE NOMINANDO,Água Branca,"RUA JOSE PEDRO FIRMINO, 41 - CENTRO",58748000,200Mbits
466,25039032,ECI PADRE JERONIMO LAUWEN,Santa Luzia,"RUA DOM QUINTINO, SN - SAO JOSE",58600000,200Mbits
467,25057146,ECI EEM ANTONIO GALDINO FILHO,Pocinhos,"RUA - JOSE JOAQUIM DO NASCIMENTO, S N - IVO BENICIO",58150000,200Mbits
468,25094696,ECI PADRE IBIAPINA,João Pessoa,"RUA VISCONDE DE OURO PRETO, SN - MANDACARU",58027641,200Mbits
469,25081403,ECIT DE ITABAIANA DOUTOR ANTONIO BATISTA SANTIAGO,Itabaiana,"AVENIDA PREFEITO ANTONIO BATISTA SANTIAGO, 416 - CENTRO",58360000,200Mbits
470,25072315,EEEF SANTO ANTONIO,Campina Grande,"RUA FRANCISCO ANTONIO DO NASCIMENTO, 1078 - CASTELO BRANCO",58406180,200Mbits
471,25094653,EEEM PROF ORLANDO CAVALCANTI GOMES,João Pessoa,"AVENIDA NEREU RAMOS, SN - CRISTO REDENTOR",58070440,200Mbits
472,25076400,EEEFM PROF ANTONIO OLIVEIRA,Campina Grande,"RUA ALBERTO SANTOS, SN - SANTA ROSA",58416690,200Mbits
473,25086901,ECI RUI CARNEIRO,Mamanguape,"AVENIDA SENADOR RUI CARNEIRO, 55 - CAMPO",58280000,200Mbits
474,25094025,ECI EEFM TENENTE LUCENA,João Pessoa,"RUA MARIA ESTER BEZERRA MESQUITA, 300 - DOS IPES",58028700,200Mbits
475,25094211,ECIT JOSE DO PATROCINIO,João Pessoa,"RUA ANTONIO CORREIA DA COSTA, SN - FUNCIONARIOS",58078590,200Mbits
476,25099205,EEEF PREFEITO ANTONIO TEIXEIRA,Santa Rita,"AVENIDA FLAVIO RIBEIRO COUTINHO, 488 - CENTRO",58300220,200Mbits
477,25009923,EEEFM PROF JOSE BENTO,Santa Helena,"RUA JOSIAS FRANCISCO DINIZ, 208 - CENTRO",58925000,200Mbits
478,25036343,EEEFM MINISTRO ALCIDES VIEIRA CARNEIRO,Princesa Isabel,"PRACA DR JOSE NOMINANDO DINIZ, 52 - CENTRO",58755000,200Mbits
479,25130153,ECIT LYNALDO CAVALCANTI DE ALBUQUERQUE,Patos,"RUA MANOEL MOTA, - MUTIRAO",58707430,200Mbits
480,25036335,ECI NOSSA SENHORA DO BOM CONSELHO,Princesa Isabel,"RUA PSICOLOGA SIMONE PEREIRA, 36 - CONJUNTO ALOYSIO PEREIRA",58755000,200Mbits
481,25092111,EEEFM PROF JOAO DA CUNHA VINAGRE,Conde,"RODOVIA PB 18 KM 3-5, SN - CENTRO",58322000,200Mbits
482,25057839,EEEFM DR CUNHA LIMA,Remígio,"RUA IDELFONSO JARDELINO DA COSTA- 75, - CENTRO",58398000,200Mbits
483,25007092,ECI EEFM PROFESSOR ADALBERTO DE SOUSA OLIVEIRA,Cachoeira dos Índios,"RUA SERGIO MOREIRA, 45 - CENTRO",58935000,200Mbits
484,25117700,EEEFM SEVERINO BARBOSA CAMELO,Boqueirão,"RUA JOSE RICARTE IRMAO, SN - MALVINAS",58450000,200Mbits
485,25094041,EEEF PROFA ARGENTINA PEREIRA GOMES,João Pessoa,"AVENIDA CAMILO DE HOLANDA, SN - CENTRO",58013360,200Mbits
486,25001833,ECI OBDULIA DANTAS,Catolé do Rocha,"AVENIDA VENANCIO NEIVA, 804 - CENTRO",58884000,200Mbits
487,25061720,ECI ESPERANCA MONSENHOR JOSE DA SILVA COUTINHO,Esperança,"RUA FLORIANO PEIXOTO, SN - CENTRO",58135000,200Mbits
488,25095056,ECIT PREFEITO OSWALDO PESSOA,João Pessoa,"RUA PROFESSOR JOSE HOLMES, SN - ERNANI SATIRO",58080400,200Mbits
489,25089820,EEEFM GENTIL LINS,Sapé,"AV SIMPLICIO COELHO, 97 - CENTRO",58340000,200Mbits
490,25099248,EEEF MACHADO DE ASSIS,Santa Rita,"RUA INGA, SN - MUNICIPIOS",58302355,200Mbits
491,25129279,ECIT JORNALISTA JOSE ITAMAR DA ROCHA CANDIDO,Cuité,"BR 104 KM 06, SN - ZONA RURAL",58175000,200Mbits
492,25093959,ECIT OLIVINA OLIVIA CARNEIRO DA CUNHA,João Pessoa,"AV DUARTE DA SILVEIRA, 450 - CENTRO",58013280,200Mbits
493,25129287,ESCOLA CIDADA INTEGRAL TECNICA ESTADUAL DE SAO BENTO,São Bento,"AV PREFEITO PEDRO EULAMPIO DA SILVA, SN - SAO BENTINHO",58865000,200Mbits
494,25094130,ECI HORACIO DE ALMEIDA,João Pessoa,"RUA DURVAL COUTINHO, SN - ALTO DO MATEUS",58090260,200Mbits
495,25129325,EEEFM ARIANO VILAR SUASSUNA,Cajazeiras,"SITIO ZE DIAS, SN - ZONA RURAL",58900000,200Mbits
496,25130242,ECIT ESTADUAL CHIQUINHO CARTAXO,Sousa,"RUA LEOPOLDO JOSE DE MELO, SN - JARDINS",58802370,200Mbits
497,25091549,ECI JOSE GUEDES CAVALCANTE,Cabedelo,"R MUNICIPALISTA PEDRO DA SILVA COUTINHO, 120 - CAMALAU",58103077,200Mbits
498,25063340,ECIT MONSENHOR JOSE BORGES DE CARVALHO,Alagoa Nova,"RUA MARIA LIMA MARACAJA, 85 - CENTRO",58125000,200Mbits
499,25099116,ECIT PROFESSOR LUIS DE AZEVEDO SOARES,Santa Rita,"AVENIDA CAMPINA GRANDE, 3188 - MUNICIPIOS",58302195,200Mbits
500,25127594,ECIT BAYEUX ERENICE CAVALCANTE FIDELIS,Bayeux,"AVENIDA LIBERDADE, 3015 - SESI",58111400,200Mbits
501,25020935,ECI MONSENHOR MANOEL VIEIRA,Patos,"PRACA EDVALDO MOTTA, - CENTRO",58700590,200Mbits
502,25078992,ECIT FRANCISCO ERNESTO DO REGO,Queimadas,"AV SEVERINO BEZERRA CABRAL, SN - CENTRO",58475000,200Mbits
503,25129295,ECIT PROFESSORA NICEA CLAUDINO PINHEIRO,Cajazeiras,"RODOVIA GOVERNADOR ANTONIO MARIZ - BR 230 KM 506, SN - CAPOEIRAS SUL",58900000,200Mbits
504,25072420,ECIT ELPIDIO DE ALMEIDA,Campina Grande,"R DUQUE DE CAXIAS, 235 - PRATA",58400506,200Mbits
505,25099507,ENEEFM ANISIO PEREIRA BORGES,Santa Rita,"RUA JOSE DE ALENCAR, SN - TIBIRI FABRICA",58300590,200Mbits
506,25100459,EEEF ALBERTO LUNDGREN,Caaporã,"RUA PROJETADA, SN - CONJUNTO PEREIRAO",58326000,200Mbits
507,25064169,EEEF MONS JOAO COUTINHO,Areia,"RUA MANOEL DA SILVA, 374 - CENTRO",58397000,200Mbits
508,25087878,EEIEFM GUILHERME DA SILVEIRA,Rio Tinto,"AVENIDA RIO BRANCO, 5466 - VILA REGINA",58297000,200Mbits
509,25099159,ECIT ENEAS CARVALHO,Santa Rita,"AVENIDA FLAVIO RIBEIRO COUTINHO, 440 - CENTRO",58300220,200Mbits
510,25099299,EEEFM CARLOS CHAGAS,Santa Rita,"AV CAMPINA GRANDE, SN - MUNICIPIOS",58302195,200Mbits
511,25128337,ECIT JOAO PEREIRA GOMES FILHO,João Pessoa,"AVENIDA HILTON SOUTO MAIOR, SN - PORTAL DO SOL",58055018,200Mbits
512,25123319,EEEF MANOEL BARBOSA DE LUCENA,Alagoa Grande,"VILA DO CRUZEIRO, 98 - CENTRO",58388000,200Mbits
513,25117521,EEEFM PROF GETULIO CESAR RODRIGUES GUEDES,Pedras de Fogo,"RUA JOSE PEREIRA DA SILVA, SN - MANGUEIRA",58328000,200Mbits
514,25089781,ECI MONSENHOR ODILON ALVES PEDROSA,Sapé,"RUA PADRE ZEFERINO MARIA, 375 - CENTRO",58340000,300Mbits
515,25089773,EEEF STELLA DA CUNHA SANTOS,Sapé,"AV DR NAPOLEAO LAURERANO, 368 - CENTRO",58340000,300Mbits
516,25098357,ECI LYCEU PARAIBANO,João Pessoa,"AVENIDA GETULIO VARGAS, SN - CENTRO",58013240,300Mbits
517,25045377,ECIT JOSE LEITE DE SOUSA,Monteiro,"RUA WAGNER AUGUSTO BEZERRA JAPYASSU, 426 - CENTRO",58500000,300Mbits
518,25097725,INSTITUTO DE EDUCACAO DA PARAIBA IEP,João Pessoa,"AV CAMILO DE HOLANDA, SN - CENTRO",58013360,300Mbits
519,25130331,ECIT PROFESSOR BRAULIO MAIA JUNIOR,Campina Grande,"RUA TRANQUILINO COELHO LEMOS, SN - DINAMERICA",58432300,300Mbits
520,25100041,EEEFM BARAO DO ABIAI,Alhandra,"AV PRESIDENTE JOAO PESSOA, 365 - CENTRO",58320000,300Mbits
521,25126350,ESCOLA TECNICA ESTADUAL DE SAUDE PROFESSORA CLORIS TORRES DE OLIVEIRA,Sapé,"RUA GENIVAL DA SILVA TORRES, SN - CENTRO",58340000,300Mbits
522,25104071,NUCLEO DE EDUCACAO DE JOVENS E ADULTOS DO ENSINO MEDIO,João Pessoa,"CIDADE UNIVERSITARIA, - ",58051900,300Mbits
523,25094181,ECI PAPA PAULO VI,João Pessoa,"AV JOSE TAVARES, SN - CRUZ DAS ARMAS",58085730,300Mbits
524,25080016,EEEFM DOM ADAUTO,Serra Redonda,"AVENIDA MIGUEL VERISSIMO DA SILVA, SN - CONJUNTO ANTONIO MARIZ II",58385000,300Mbits
525,25088971,EEEF LUIZ MARIA DE FRANCA,Mari,"RUA MANOEL GOMES FILHO, SN - SILVINO COSTA",58345000,300Mbits
526,25094203,ECIT DOM JOSE MARIA PIRES,João Pessoa,"RUA DAS ROSAS, SN - B DAS INDUSTRIAS",58083332,300Mbits
527,25036297,EEEIF PROFESSORA IRACEMA MARQUES DE LIMA,Princesa Isabel,"RUA SOLON DE LUCENA, 0 - CENTRO",58755000,300Mbits
