#,INEP,ESCOLA,MUNICÍPIO,LOGRADOURO,CEP,Velocidade Link
232,25000047,ECI NOSSA SENHORA DA CONCEICAO,Belém do Brejo do Cruz,"RUA JOAO BATISTA DE OLIVEIRA FORTE, 411 - CENTRO",58895000,200Mbits
233,25030175,EEEF FRANCA LEITE,Ibiara,"RUA OSORIO PINTO RAMALHO, 430 - CENTRO",58980000,200Mbits
234,25054180,ECI JORNALISTA JOSE LEAL RAMOS,São João do Cariri,"ALTO DO CRUZEIRO, SN - CENTRO",58590000,200Mbits
235,25072145,EEEFM DOM LUIZ GONZAGA FERNANDES,Campina Grande,"RUA DAS PITOMBEIRAS, SN - MALVINAS",58432791,200Mbits
236,25105183,EEEF IRMA SEVERINA CAVALCANTE SOUTO,João Pessoa,"RUA RODRIGUES CHAVES, SN - CENTRO",58011040,200Mbits
237,25120859,EEEFM PROF MARIA JOSE COSTA DE ALBUQUERQUE,Olivedos,"RUA RONDINELLE GUIMARAES COUTO, SN - CENTRO",58160000,200Mbits
238,25018094,EEEFM DR JOSE GADELHA,Aparecida,"RUA JOAO AMANCIO PIRES, 95 - CENTRO",58823000,200Mbits
239,25020889,EEEFM LUCIA WANDERLEY DE FREITAS,Patos,"RUA VEREADOR JOSE CAETANO FILHO, 36 - DISTRITO SANTA GERTRUDES",58709000,200Mbits
240,25049640,EEEF DE AMPARO,Amparo,"RUA VEREADOR CICERO SOARES, 62 - CENTRO",58548000,200Mbits
241,25066013,ECI EEFM ANTONIO BENTO,Serraria,"RUA ADALGISA CAVALCANTE, 328 - CENTRO",58395000,200Mbits
242,25080270,EEEFM DE CALDAS BRANDAO,Caldas Brandão,"RUA MANOEL DANTAS, 157 - CENTRO",58350000,200Mbits
243,25093860,ECIT RAUL MACHADO,João Pessoa,"AVENIDA CARNEIRO DE CAMPOS, SN - ILHA DO BISPO",58011440,200Mbits
244,25001302,EEEFM OLIVIA SARAIVA MAIA,São José do Brejo do Cruz,"RUA CONEGO SANDOVAL, 124 - CENTRO",58893000,200Mbits
245,25012940,ECI EEM JOSE NILSON SANTIAGO,Poço Dantas,"RUA ODILON FRANCISCO DE OLIVEIRA, SN - CENTRO",58933000,200Mbits
246,25018140,EEEFM CELSO MARIZ,Sousa,"ARY FERNANDES DE ARAGAO, SN - JARDIM SORRILANDIA III",58805535,200Mbits
247,25040014,ECIT SERAFICO NOBREGA,São Mamede,"RUA JOSE PEQUENO DE OLIVEIRA, 91 - CENTRO",58625000,200Mbits
248,25072030,ECI NENZINHA CUNHA LIMA,Campina Grande,"RUA FERNANDES VIEIRA, SN - JOSE PINHEIRO",58407490,200Mbits
249,25072056,EEEFM POETA CARLOS DRUMOND DE ANDRADE,Campina Grande,"RUA CAICO, SN - BODOCONGO",58433140,200Mbits
250,25009931,ECI ELAINE SOARES BRASILEIRO,Santa Helena,"RUA JOANA FERREIRA DE SOUSA, 272 - CENTRO",58925000,200Mbits
251,25018183,EEEFM ESTEVAM MARINHO,Sousa,"AVENIDA RIO PIRANHAS, - CENTRO",58814000,200Mbits
252,25021427,ENE D EXPEDITO E DE OLIVEIRA,Patos,"RUA PAULO LEITE, SN - LIBERDADE",58703130,200Mbits
253,25072293,EEEFM NOSSA SENHORA APARECIDA,Campina Grande,"RUA ROSA MARIA BANDEIRA DA SILVA, SN - MUTIRAO",58436108,200Mbits
254,25090984,ECI EEFM JOAO CAETANO,Bayeux,"RUA PASTOR ANTONIO PETRONILO DOS SANTOS, 322 - JARDIM AEROPORTO",58113363,200Mbits
255,25094475,EEEF EPITACIO PESSOA,João Pessoa,"AVENIDA MONSENHOR WALFREDO LEAL, SN - TAMBIA",58020540,200Mbits
256,25094688,ECIT PADRE HILDON BANDEIRA,João Pessoa,"AV CAETANO FILGUEIRAS, SN - TORRE",58040000,200Mbits
257,25014692,ECIT DOUTOR ANTONIO FERNANDES MEDEIROS,Malta,"RUA- CEL ANTONIO DE ASSIS FERREIRA, SN - CENTRO",58713000,200Mbits
258,25026402,EEEIEF ADEMAR LEITE,Piancó,"RUA CEL JOAO LEITE, 26 - CENTRO",58765000,200Mbits
259,25050435,ECIT MELQUIADES VILAR,Taperoá,"RUA ISMENIA MACHADO, 38 - CENTRO",58680000,200Mbits
260,25026488,EEEF MARIA ELIZA MONTENEGRO DE SOUZA,Piancó,"RUA ANTONIO LEITE MONTENEGRO, SN - CAIXA DAGUA",58765000,200Mbits
261,25046764,EEEFM NOSSA SRA DAS GRACAS,Ouro Velho,"RUA JOSE CASSIANO, SN - CENTRO",58560000,200Mbits
262,25094661,ECI EEFM PEDRO LINS VIEIRA DE MELO,João Pessoa,"RUA FRANCISCO PEREIRA DE SOUSA, 130 - MANGABEIRA I",58055440,200Mbits
263,25152823,EEEFM EUCLIDES MOUZINHO SANTOS,Algodão de Jandaíra,"RUA PROJETADA, SN - CONJUNTO NOVO",58399000,200Mbits
264,25048880,EEEFM SENADOR JOSE GAUDENCIO,Serra Branca,"RUA BOAVENTURA CAVALCANTE NETO, 79 - CENTRO",58580000,200Mbits
265,25053124,ECIT ALCIDES BEZERRA,Cabaceiras,"RUA PRACA GENERAL JOSE PESSOA, 80 - CENTRO HISTORICO",58480000,200Mbits
266,25055046,ECIT JOSE LUIZ NETO,Barra de Santa Rosa,"RUA PREFEITO JOAO INACIO DA SILVA, 170 - CENTRO",58170000,200Mbits
267,25064134,ECIT MINISTRO JOSE AMERICO DE ALMEIDA,Areia,"PRACA MINISTRO JOSE AMERICO, 321 - CENTRO",58397000,200Mbits
268,25091620,ECI EEFM ABREU E LIMA,Cabedelo,"RUA MARGARIDA MARIA ALVES, 27 - RENASCER II",58108172,200Mbits
269,25094971,EEEF MONS ODILON COUTINHO,João Pessoa,"AV CELERINA PAIVA, SN - MANDACARU",58027390,200Mbits
270,25117866,EEEFM POETISA VICENTINA FIGUEIREDO VITAL DO REGO,Campina Grande,"RUA SAO RAFAEL, SN - JEREMIAS",58404072,200Mbits
271,25010565,ECIT PREFEITO JOAQUIM LACERDA LEITE,São José de Piranhas,"RUA RAIMUNDO ALVES, 125 - SANTO ANTONIO",58940000,200Mbits
272,25019538,ECI DOUTOR SILVA MARIZ,Marizópolis,"RUA BELARMINO RUFINO DE CARVALHO, 22 - CENTRO",58819000,200Mbits
273,25020978,EEEF PROFA MARIA NUNES,Patos,"RUA VALDEMAR VIEIRA, SN - SAO SEBASTIAO",58706330,200Mbits
274,25053728,ECI EEM JUAREZ MARACAJA,Gurjão,"RUA ALFREDO TEIXEIRA DE FREITAS, 281 - PEDREGAL",58670000,200Mbits
275,25081462,EEEF PROF MENDONCA,Itabaiana,"RUA ARARE DUARTE DO AMARAL, SN - CONJUNTO COSTA E SILVA",58360000,200Mbits
276,25099167,EEEF JOSE MARIANO,Santa Rita,"AVENIDA CAMPINA GRANDE, SN - MUNICIPIOS",58302195,200Mbits
277,25111841,EEEF INDIGENA JOSE FERREIRA PADILHA,Marcação,"ALDEIA VAU RUA PRINCIPAL, SN - ZONA RURAL",58294000,200Mbits
278,25114484,ECIT JOAO ROBERTO BORGES DE SOUZA,João Pessoa,"RUA OSORIO MILANEZ FILHO, SN - MANGABEIRA",58056280,200Mbits
279,25118560,EEEFM JOANA IVONILDES BANDEIRA,Pombal,"RUA CROMACIO WANDERLEY, SN - VIDA NOVA",58840000,200Mbits
280,25151401,EEEFM ANTONIO GUEDES DE ANDRADE,Campina Grande,"RUA SEVERINO DA COSTA, 200 - CATOLE DE ZE FERREIRA",58418030,200Mbits
281,25153200,EEEM MATILDES DE MELO BURUTI,Pedra Lavrada,"DIST CUMARU, - ZONA RURAL",58180000,200Mbits
282,25019228,EEEFM ANTONIO TEODORO NETO,Sousa,"RUA VEREADOR JOSE GONCALVES FORMIGA, SN - SANTAREM",58808470,200Mbits
283,25019740,EEEM MARIA MOREIRA PINTO,Vieirópolis,"RUA AGRIPINO FERNANDES DAS CHAGAS, SN - CENTRO",58822000,200Mbits
284,25039504,EEEFM OLAVO BILAC,São José do Sabugi,"RUA SEVERINO ARNALDO, 325 - CENTRO",58610000,200Mbits
285,25060996,ECI DR TERCILIO TEIXEIRA DA CRUZ,Tacima,"RUA 31 DE MARCO, 582 - CENTRO",58240000,200Mbits
286,25091018,EEEF VERALDO LEITE,Bayeux,"RUA CAROLINA MACHADO, SN - TAMBAY",58110560,200Mbits
287,25093916,ECIT PROFESSOR RAUL CORDULA,João Pessoa,"RUA JUAREZ TAVORA, SN - TORRE",58041974,200Mbits
288,25007718,EEEFM PROF MANOEL MANGUEIRA LIMA,Cajazeiras,"RUA JOSE LEITE DE OLIVEIRA, 215 - POR DO SOL",58900000,200Mbits
289,25077163,EEEF FREI ALBERTO,Fagundes,"RUA PLINIO LEMOS, 13 - CENTRO",58487000,200Mbits
290,25078569,EEEF SEVERIANO PEDRO DO NASCIMENTO,Puxinanã,"POVOADO DE JENIPAPO, SN - ",58115000,200Mbits
291,25079115,ESCOLA ESTADUAL DE ENSINO FUNDAMENTAL MEDIO E EJA JOSE TAVARES,Queimadas,"RUA JOAO BARBOSA DA SILVA, SN - CENTRO",58475000,200Mbits
292,25084526,ECIT FRANCISCO DE ALBUQUERQUE MONTENEGRO,Natuba,"AV DRA FRANCISCO DE ALBUQUERQUE MONTENEGRO, SN - CENTRO",58494000,200Mbits
293,25095080,EEEFM PADRE ROMA,João Pessoa,"RUA EMILIO DE ARAUJO CHAVES, 120 - ALTIPLANO",58046150,200Mbits
294,25095153,EEEF PROF RITA DE MIRANDA HENRIQUES,João Pessoa,"RUA FRANCISCO PORFIRIO RIBEIRO, SN - MANGABEIRA IV",58057100,200Mbits
295,25003054,EEEFM FREI BRUNO,Lagoa,"TRAVESSA SIMPLICIO ROQUE, 02 - CENTRO",58835000,200Mbits
296,25007904,EEEFM MONS CONSTANTINO VIEIRA,Cajazeiras,"RUA PADRE ROLIM, 457 - CENTRO",58900000,200Mbits
297,25017438,EEEFM ANTONIO GREGORIO DE LACERDA,São José da Lagoa Tapada,"RUA ANTONIO GREGORIO DE LACERDA, SN - SANHAUA",58815000,200Mbits
298,25025368,EEEFM PROF MARGARIDA REMIGIO LOUREIRO,Emas,"AV DR JOSE CELINO FILHO, 107 - CENTRO",58763000,200Mbits
299,25088785,ECI TEONAS DA CUNHA CAVALCANTI,Juripiranga,"RUA SENADOR RUI CARNEIRO, 122 - CENTRO",58330000,200Mbits
300,25001477,ECI EEFM PROFESSORA DIVA GUEDES DE ARAUJO,Brejo dos Santos,"RUA APOLONIO PEREIRA DE SOUSA, 150 - CENTRO",58880000,200Mbits
301,25027174,EEEF DOUTOR FELIZARDO TEOTONIO DANTAS,Santana dos Garrotes,"RUA JOAO ARAUJO FONSECA, 51 - CENTRO",58795000,200Mbits
302,25072692,ENE PE EMIDIO VIANA CORREIA,Campina Grande,"AV SEVERINO BEZERRA CABRAL, SN - CATOLE",58410185,200Mbits
303,25034200,ECIT MARIA DO SOCORRO RAMALHO QUIRINO,Imaculada,"RUA DELMIRO DANTAS, SN - CENTRO",58745000,200Mbits
304,25067869,ECI EEFM ODILON NELSON DANTAS,Cuitegi,"RUA JOSE MARINHO DE LUCENA, SEM NUMERO - SANTO ANTONIO",58208000,200Mbits
305,25089811,EEEF FAZENDA BURACAO,Sapé,"FAZENDA BURACAO, SN - SITIO",58340000,200Mbits
306,25094033,ECIT MANOEL LISBOA DE MOURA,João Pessoa,"RUA ANTONIO CLAUDINO LEAL, SN - COSTA E SILVA",58081010,200Mbits
307,25066676,ECI FRANCISCO PESSOA DE BRITO,Araçagi,"AVENIDA OLIVIO MAROJA SN ARACAGI - PB, - SAO SEBASTIAO",58270000,200Mbits
308,25072137,ECI ANESIO LEAO,Campina Grande,"RUA XV DE NOVEMBRO, SN - PALMEIRA",58401075,200Mbits
309,25090976,EEEF GETULIO VARGAS,Bayeux,"RUA IVANIA MENEZES, 284 - CENTRO",58110260,200Mbits
310,25102519,EEEFM ANTONIO CAMELO,Alhandra,"RUA JOSE JOAO DA SILVA, SN - MATA REDONDA",58320000,200Mbits
311,25129317,EEEFM PAULO FREIRE,Campina Grande,"ALCA SUDOESTE, SN - SERROTAO",58436220,200Mbits
312,25012924,EEEFM JOVELINA GOMES,Uiraúna,"RUA JOAO PESSOA, 88 - SAO JOSE",58915000,200Mbits
313,25062239,EEEF ELIDIO SOBREIRA,São Sebastião de Lagoa de Roça,"RUA JOSE RODRIGUES COURA, 21 - CENTRO",58119000,200Mbits
314,25072080,EEEFM NINA ALVES DE LIMA,Campina Grande,"RUA FRANCISCO ROSA DE FARIAS, SN - MONTE SANTO",58400710,200Mbits
315,25094254,EEEF PADRE CICERO ROMAO BATISTA,João Pessoa,"R JOSE BETHANIO, SN - MANDACARU",58027587,200Mbits
316,25114905,ECI EEFM MILTON CAMPOS,João Pessoa,"R- SEVERINA MARIA VASCONCELOS DE CARVALHO, SN - CUIA",58077156,200Mbits
317,25043897,ECI EEM CICERO DOS ANJOS,São Vicente do Seridó,"RUA ALZIRA XAVIER, S/N - CENTRO",58158000,200Mbits
318,25093886,ECIT FRANCISCA ASCENSAO CUNHA,João Pessoa,"RUA LUIZ GONZAGA G VIEIRA, 700 - BANCARIOS",58051700,200Mbits
319,25117858,EEEF REITOR EDVALDO DO O,Campina Grande,"ISOLDA BARROS TORQUATO, SN - BODOCONGO",58430290,200Mbits
320,25075918,ECI EEM TEODOSIO DE OLIVEIRA LEDO,Boa Vista,"RUA PREFEITO SEVERINO CABRAL, 230 - CENTRO",58123000,200Mbits
321,25094629,EEEF PROF MARIA GENY DE SOUSA TIMOTEO,João Pessoa,"AV MONSENHOR WALFREDO LEAL, 551 - TAMBIA",58020540,200Mbits
322,25012207,ECI EEM BERNARDINO JOSE BATISTA,Triunfo,"TABELIAO ANTONIO LISBOA LISBOA, SN - BELA VISTA",58920000,200Mbits
323,25034839,ECI ARLINDA PESSOA DA SILVA,Juru,"AVENIDA DALMO TEIXEIRA SETOR SERRA BRANCA, SN - SERRA BRANCA",58750000,200Mbits
324,25088530,ECI EEFM DEPUTADO FERNANDO MILANEZ,Cruz do Espírito Santo,"RUA DR JOAO URSULO, SN - CENTRO",58337000,200Mbits
325,25000659,EEEFM ANTONIO GOMES,Brejo do Cruz,"RUA ANGELINA MARIZ, 50 - CENTRO",58890000,200Mbits
326,25060384,EEEF CELSO CIRNE,Solânea,"PRACA 26 DE NOVEMBRO, SN - CENTRO",58225000,200Mbits
327,25062816,ECIT OSWALDO TRIGUEIRO DE ALBUQUERQUE MELO,Alagoa Grande,"RUA RUI BARBOSA, SN - CENTRO",58388000,200Mbits
328,25085875,EEEFM MATIAS FREIRE,Baía da Traição,"RUA MATIAS FREIRE, 1168 - CENTRO",58295000,200Mbits
329,25087908,EEEFM FREDERICO LUNDGREN,Rio Tinto,"RUA DA AURORA, SN - CENTRO",58297000,200Mbits
330,25040820,ECI IOLANDA TEREZA CHAVES LIMA,Cubati,"RUA VALDEMIR DE SOUSA SOUTO, SN - CENTRO",58167000,200Mbits
331,25062220,ECI EEM MONSENHOR JOSE BORGES,São Sebastião de Lagoa de Roça,"RUA LAURA DONATO DE ARAUJO, SN - CENTRO",58119000,200Mbits
332,25063405,ECIT POETA MARIO VIEIRA DA SILVA,Matinhas,"ST CAMARA, SN - ZONA RURAL",58128000,200Mbits
333,25064126,EEEIEFM CARLOTA BARREIRA,Areia,"PRACA MONSENHOR RUY BARREIRA VIEIRA, SN - CENTRO",58397000,200Mbits
334,25093851,ECI LILIOSA PAIVA LEITE,João Pessoa,"AV DOM BOSCO, SN - CRISTO REDENTOR",58070470,200Mbits
335,25030167,EEEF DE IBIARINHA,Ibiara,"RUA SANTA MARIA, 641 - IBIARINHA",58980000,200Mbits
336,25052802,EEEFM FELIX ARAUJO,Caturité,"RUA JOAO QUEIROGA, SN - CENTRO",58455000,200Mbits
337,25051580,ECIT CONSELHEIRO JOSE BRAZ DO REGO,Boqueirão,"AV NOSSA SENHORA DO DESTERRO, - CENTRO",58450000,200Mbits
338,25070088,EEEFM SILVIO PORTO,Pilõezinhos,"RUA MANOEL ALVES DE SOUZA, 309 - CENTRO",58210000,200Mbits
339,25072153,ECI SEVERINO CABRAL,Campina Grande,"RUA JOAQUIM AMORIM JUNIOR, SN - BODOCONGO",58430200,200Mbits
340,25092898,EEEFM DE EJA PROF GERALDO LAFAYETTE BEZERRA,João Pessoa,"RUA FELINTO DE ARRUDA ESCOLASTICO, SN - CRISTO REDENTOR",58070380,200Mbits
341,25003410,ECIT EEFM DANIEL CARNEIRO,Riacho dos Cavalos,"RUA DR ANTONIO CARNEIRO, 60 - CENTRO",58870000,200Mbits
342,25020986,EEEF RIO BRANCO,Patos,"AV FLORIANO PEIXOTO, SN - JARDIM CALIF RNIA",58700300,200Mbits
343,25058304,ECIT DOUTOR TRAJANO NOBREGA,Soledade,"JOSE RUFINO DE CARVALHO, SN - JARDIM CRUZEIRO",58155000,200Mbits
344,25072102,ECI DEPUTADO ALVARO GALDENCIO DE QUEIROZ,Campina Grande,"RUA DOS JUCAS, SN - MALVINAS",58432599,200Mbits
345,25089250,ECI EEM JOSE LINS DO REGO,Pilar,"RUA JOAO NOLASCO DA CRUZ GOUVEIA, - SERVENTIA",58338000,200Mbits
346,25036017,ECI EEFM MONSENHOR SEBASTIAO RABELO,Manaíra,"RUA SILVERIO ALVES LISBOA, SN - CENTRO",58995000,200Mbits
347,25120670,EEEFM MAJOR VENEZIANO VITAL DO REGO,Campina Grande,"RUA MARIA CANDIDA DA SILVA, S/N - ACACIO FIGUEIREDO",58421295,200Mbits
348,25033794,EEEFM PEDRO TERTO DA CUNHA,Cacimbas,"RUA FERNANDES FERREIRA, - CENTRO",58698000,200Mbits
349,25055836,ECI ORLANDO VENANCIO DOS SANTOS,Cuité,"RUA 15 DE NOVEMBRO, SN - CENTRO",58175000,200Mbits
350,25086316,ECIT ALZIRA LISBOA,Jacaraú,"RUA 7 DE SETEMBRO, 453 - SAO JOSE",58278000,200Mbits
351,25086332,EEEFM CASTRO PINTO,Jacaraú,"PRACA DOUTOR ORESTES LISBOA, 43 - CENTRO",58278000,200Mbits
352,25100696,ECI JOAO URSULO,Pedras de Fogo,"RUA SANTO ANTONIO, SN - SANTO ANTONIO",58328000,200Mbits
353,25012916,ECIT DOUTOR JOSE DUARTE FILHO,Uiraúna,"RUA FRANCISCO LEAO VELOSO, 448 - CENTRO",58915000,200Mbits
354,25087894,EEIEFM DR JOSE LOPES RIBEIRO,Rio Tinto,"RUA SAO JOAO, SN - ALDEIA MONTE MOR",58297000,200Mbits
355,25030698,EEEF SIMEAO LEAL,Itaporanga,"PRACA DEP BALDUINO DE CARVALHO, 32 - CENTRO",58780000,200Mbits
356,25057820,ECIT JOSE BRONZEADO SOBRINHO,Remígio,"AV JOAQUIM CAVALCANTE DE MORAIS, SN - CENTRO",58398000,200Mbits
357,25093835,ECI LUIS RAMALHO,João Pessoa,"AV COMERCIANTE ALFREDO FERREIRA DA ROCHA, SN - MANGABEIRA I",58055540,200Mbits
358,25018221,EEEF CONEGO JOAO CARTAXO ROLIM,Sousa,"RUA DORGIVAL DA NOBREGA ASSIS, SN - ALTO DO CRUZEIRO",58806250,200Mbits
359,25072439,ECI HORTENCIO SOUSA RIBEIRO PREMEN,Campina Grande,"OTACILIO NEPOMUCENO, SN - CATOLE",58410160,200Mbits
360,25086049,ECI SEVERINO FELIX DE BRITO,Itapororoca,"RUA SETE DE SETEMBRO, SN - BAIRRO DOS ESTUDANTES",58275000,200Mbits
361,25088068,ESCOLA CIDADA INTEGRAL INDIO ANTONIO SINESIO DA SILVA,Marcação,"ALDEIA BREJINHO, SN - ZONA RURAL",58294000,200Mbits
362,25130110,ECIT SERRA BRANCA INACIO ANTONINO,Serra Branca,"PB 200, - SITIO LAGOINHA",58580000,200Mbits
363,25090135,ECI EEFM CASSIANO RIBEIRO COUTINHO,Sapé,"RUA MANOEL MOREIRA DA SILVA, 135 - CENTRO",58340000,200Mbits
364,25041525,ECIT DEPUTADO GENIVAL MATIAS,Juazeirinho,"RUA PROFESSORA JOSEFA NETA FREIRE, 180 - CENTRO",58660000,200Mbits
365,25089552,EEEFM MARIA LINS,São Miguel de Taipu,"AV EMILIA AUGUSTA, 25 - CENTRO",58334000,200Mbits
366,25094122,CPM ESTUDANTE REBECA CRISTINA ALVES SIMOES,João Pessoa,"RUA MARIA ALVES DA SILVA, 00 - MANGABEIRA",58058400,200Mbits
367,25006223,ECI EEM MONSENHOR MORAIS,Bonito de Santa Fé,"RUA APRIGIO PEREIRA DA SILVA, 01 - ALTO DA BOA VISTA",58960000,200Mbits
368,25017080,ECI EEFM VALDEMIRO WANDERLEY DE OLIVEIRA,Santa Cruz,"CONJUNTO MAURICIO GOMES, SN - SAO FRANCISCO",58824000,200Mbits
369,25018639,EEEF DR THOMAZ PIRES,Sousa,"RUA RAIMUNDO PEREIRA DE OLIVEIRA, SN - JARDIM SORRILANDIA I",58805150,200Mbits
370,25051296,EEE FUNDAMENTAL E MEDIO MELQUIADES TEJO,Barra de São Miguel,"RUA TENENTE PEDROSA, 161 - CENTRO",58483000,200Mbits
371,25062638,EEEFM PADRE HILDON BANDEIRA,Alagoa Grande,"RUA PRESIDENTE JOAO PESSOA, 1485 - CENTRO",58388000,200Mbits
372,25094173,EEEFM E EJA PADRE MIGUELINHO,João Pessoa,"AVENIDA DA FRATERNIDADE, SN - CRISTO REDENTOR",58070310,200Mbits
373,25094351,EEEF ANTONIO PESSOA,João Pessoa,"RUA BEAUREPAIRE ROHAN, 149 - CENTRO",58010000,200Mbits
374,25002422,ECI EEFM FRANCISCO MAIA,Jericó,"RUA JOSE MESQUITA, 112 - CENTRO",58830000,200Mbits
375,25058371,EEEFM E EJA PADRE JOSE ANTONIO MARIA IBIAPINA,Soledade,"RUA JOSE CHAGAS DE BRITO, 02 - CENTRO",58155000,200Mbits
376,25078135,ECI EEFM MARIA ZECA SOUZA,Massaranduba,"RUA VEREADOR ADERBAL GOMES DA SILVA, SN - CENTRO",58120000,200Mbits
377,25078550,ECI PLINIO LEMOS,Puxinanã,"RUA COSTA E SILVA, - CENTRO",58115000,200Mbits
378,25094726,ECI EEFM PROFESSOR CELESTIN MALZAC,João Pessoa,"RUA PROFESSORA MARIA ZENAIDE BRASILINO, SN - VALENTINA",58063320,200Mbits
379,25113810,EEEFM ISAURA FERNANDES DE SOUZA,Itapororoca,"RUA PROJETADA, SN - EPITACIO MADRUGA",58275000,200Mbits
380,25114433,EEEFM SENADOR HUMBERTO LUCENA,Campina Grande,"RUA MARCELINO PEREIRA DA COSTA, SN - NOVO CRUZEIRO",58415483,200Mbits
381,25094556,EEEF ISABEL MARIA DAS NEVES,João Pessoa,"AV JOAO MACHADO, 484 - CENTRO",58013520,200Mbits
382,25000640,ECI JOSE OLIMPIO MAIA,Brejo do Cruz,"RUA HORACIO PIMENTA, 225 - CENTRO",58890000,200Mbits
383,25043277,ECI PROFESSOR LORDAO,Picuí,"RUA PROJETADA, SN - CENECISTA",58187000,200Mbits
384,25099175,ECIT MARIA HONORINA SANTIAGO,Santa Rita,"RUA PROFESSOR SEVERO RODRIGUES, SN - POPULAR",58301000,200Mbits
385,25020927,ECI AUZENIR LACERDA,Patos,"RUA LUIS JOSE, SN - JARDIM LACERDA",58704030,200Mbits
386,25001825,ESC AGROTECNICA DO CAJUEIRO CAMPUS IV - UEPB,Catolé do Rocha,"SITIO CAJUEIRO, S/N - ZONA RURAL",58884000,200Mbits
387,25093827,EEEF CLAUDINA MANGUEIRA DE MOURA,João Pessoa,"R CARTEIRO FRANCISCO INACIO DO REGO FILHO, 43 - ALTO DO MATEUS",58090570,200Mbits
388,25094459,EEEF DR OTAVIO NOVAIS,João Pessoa,"AVENIDA SANTOS STANISLAU, 1255 - NOVAIS",58088540,200Mbits
389,25012185,EEEF ANTONIO FRANCISCO DUARTE,Triunfo,"AV JOSE DUARTE DE SA, 89 - CENTRO",58920000,200Mbits
390,25035444,EEEF PROFESSORA ANTONIA DINIZ MAIA,Manaíra,"PRACA JOAQUIM SIMAO, 06 - CENTRO",58995000,200Mbits
391,25099230,EEEF JOAO URSULO,Santa Rita,"PRACA JOAO PESSOA, 02 - CENTRO",58300140,200Mbits
392,25015869,ECITEEFM MONSENHOR VICENTE FREITAS,Pombal,"RUA PROFESSOR LUIZ FERREIRA CAMPOS, 309 - JARDIM ROGERIO",58840000,200Mbits
393,25037226,ECI ADRIANO FEITOSA,Tavares,"RUA SEVERINO CARLOS DE ANDRADE, 489 - CENTRO",58753000,200Mbits
394,25072161,EEEF NOSSA SENHORA DO ROSARIO,Campina Grande,"RUA NILO PECANHA, 250 - PRATA",58400515,200Mbits
395,25103563,EEEFM PROFESSOR JOSE GOMES ALVES,Patos,"DONATO LOCIO, SN - JATOBA",58707380,200Mbits
396,25014951,EEEFM FRANCISCO AUGUSTO CAMPOS,Nazarezinho,"RUA HERCULANO VIEIRA, SN - FRANCISCO MENDES CAMPOS",58817000,200Mbits
397,25072226,EEEF DE APLICACAO,Campina Grande,"AVENIDA PREFEITO SEVERINO BEZERRA CABRAL, SN - CATOLE",58410185,200Mbits
398,25089838,ECI EEFM RIACHAO DO POCO,Riachão do Poço,"RUA JOAO FERREIRA ALVES, SN - CENTRO",58348000,200Mbits
399,25092839,CEEEA SESQUICENTENARIO,João Pessoa,"RUA MANOEL FRANCA, SN - CONJUNTO PEDRO GONDIM",58031160,200Mbits
400,25004883,ECIT CORONEL JACOB GUILHERME FRANTZ,São João do Rio do Peixe,"RUA PADRE JOAQUIM CIRILO DE SA, 95 - CENTRO",58910000,200Mbits
401,25045059,ECI JOAO LELYS,Livramento,"RUA PRESIDENTE JOAO PESSOA, 54 - CENTRO",58690000,200Mbits
402,25050427,ECI EEM JOAO ROGERIO DIAS TOLEDO,Assunção,"RUA CANDIDO PEREIRA BRITO, SN - CONJUNTO HABITACIONAL JOSE DE ASSIS PIMENTA",58685000,200Mbits
403,25061402,EEEFM FRANCISCO A SILVA,Areial,"FRANCISCO SEBASTIAO PEREIRA, 78 - CENTRO",58140000,200Mbits
404,25087673,ECI HENRIQUE FERNANDES DE FARIAS,Curral de Cima,"TRAVESSA OLEGARIO FERNANDES, 397 - CENTRO",58291000,200Mbits
405,25094190,ECIT JOAO GOULART,João Pessoa,"RUA CONEGO FRANCISCO, SN - CASTELO BRANCO III",58050690,200Mbits
406,25018132,EEEF BENTO FREIRE,Sousa,"RUA JOAQUIM PINTO NETO, 02 - ESTACAO",58807275,200Mbits
407,25054767,EEEFM E EJA ANESIO DEODONIO MORENO,Arara,"RUA HERMES LIRA, 154 - CENTRO",58396000,200Mbits
408,25072374,EEEF MARIA EMILIA OLIVEIRA DE ALMEIDA,Campina Grande,"RUA DR FRANCISCO BRASILEIRO, SN - PRESIDENTE MEDICI",58417455,200Mbits
409,25056620,ECI EEFM JOSE ROLDERICK DE OLIVEIRA,Nova Floresta,"RUA DAMIAO PEDRO DE LIMA- S N- NOVA FLORESTA PB, S/N - SILVESTRE GARCIA",58178000,200Mbits
410,25069373,EEEF GETULIO VARGAS,Lagoa de Dentro,"RUA DO COMERCIO, 55 - CENTRO",58250000,200Mbits
411,25069675,ECI EEFM MAJOR ANTONIO DE AQUINO,Mulungu,"ESTRADA DE ACESSO A ALAGOINHA, SN - CENTRO",58354000,200Mbits
412,25087304,ECI EEM JOSE WILSON DE ALBUQUERQUE MELO,Capim,"CONJUNTO BELA VISTA, SN - CENTRO",58287000,200Mbits
413,25090933,EEEF ALVARO DE CARVALHO,Bayeux,"RUA JOAQUIM FERNANDES, - CENTRO",58110097,200Mbits
414,25004875,ENE MIN JOSE AMERICO DE ALMEIDA,São João do Rio do Peixe,"RUA VIDAL DE NEGREIROS, 134 - CENTRO",58910000,200Mbits
415,25004875,ENE MIN JOSE AMERICO DE ALMEIDA,São João do Rio do Peixe,"RUA VIDAL DE NEGREIROS, 134 - CENTRO",58910000,200Mbits
416,25062069,ECI MARIA JOSE DE SOUZA,Montadas,"RUA JOSE VERISSIMO DE SOUZA, 197 - CENTRO",58145000,200Mbits
417,25087860,ECI LUIZ GONZAGA BURITY,Rio Tinto,"PRACA DA VITORIA, SN - CENTRO",58297000,200Mbits
418,25094050,ECIT LUIZ GONZAGA DE ALBUQUERQUE BURITY,João Pessoa,"AVENIDA MONSENHOR WALFREDO LEAL, 440 - TAMBIA",58020540,200Mbits
419,25126180,ECI LINDUARTE NORONHA,João Pessoa,"RUA ANTONIO FERNANDES, SN - GRAMAME",58069325,200Mbits
420,25084950,ECIT PRESIDENTE JOAO PESSOA,Umbuzeiro,"RUA EPITACIO PESSOA, 141 - CENTRO",58497000,200Mbits
421,25128418,ECI HELINTON SANTANA,Santa Rita,"RUA VEREADOR MAILTON WELLINGTON, SN - NOVA TRINDADE",58300970,200Mbits
422,25007840,EEEF MONSENHOR JOAO MILANES,Cajazeiras,"PRACA DOM ADAUTO, SN - CENTRO",58900000,200Mbits
423,25037803,ECIT SEBASTIAO GUEDES DA SILVA,Teixeira,"RUA CONEGO SERRAO, 21 - CENTRO",58735000,200Mbits
424,25090909,ECI IRINEU PINTO,Bayeux,"AVENIDA JOAO XXIII, 81 - SESI",58111320,200Mbits
425,25012959,EEEF ERNANI SATIRO,Uiraúna,"RUA BRASILIANO VIEIRA, 34 - ALTO BELA VISTA",58915000,200Mbits
426,25018124,EEEF BATISTA LEITE,Sousa,"RUA LUIS PEREIRA DA SILVA, 22 - CENTRO",58800040,200Mbits
427,25090941,EEEF ANITA GARIBALDI,Bayeux,"RUA PADRE FEIJO, 253 - TAMBAI",58110618,200Mbits
428,25114034,EEEF DOM HELDER CAMARA,Campina Grande,"RUA LICIONEIA MARIA DA CONCEICAO, 125 - SANTA ROSA",58417020,200Mbits
429,25018256,EEEF DE DEMONSTRACAO DE SOUSA,Sousa,"RUA JOSE DE PAIVA GADELHA, 141 - GATO PRETO",58802085,200Mbits
430,25082493,ECIT OTAVIA SILVEIRA,Mogeiro,"RUA ANTONIO DE ANDRADE SOBRINHO, SN - CENTRO",58375000,200Mbits
431,25072021,EEEFM SEN ARGEMIRO DE FIGUEIREDO,Campina Grande,"AV ELPIDIO DE ALMEIDA, 25 - CATOLE",58410215,200Mbits
432,25005995,ECI PROFESSORA FRANCISCA FONSECA MATIAS,Poço de José de Moura,"AVENIDA FREI DAMIAO, SN - POPULARES",58908000,200Mbits
433,25037781,EEEFM ANTONIO MOACIR DANTAS CAVALCANTI,Maturéia,"AVENIDA JOSE JERONIMO, 282 - CENTRO",58737000,200Mbits
434,25020854,ECI DOUTOR DIONISIO DA COSTA,Patos,"RUA FRANCISCO PONTES, SN - SALGADINHO",58706520,200Mbits
435,25084445,EEEFM JOAO DA SILVA MONTEIRO,Gado Bravo,"RUA JOSE PEREIRA DE AGUIAR, SN - CENTRO",58492000,200Mbits
436,25090887,ECIT PROFESSOR ANTONIO GOMES,Bayeux,"RUA PROFESSOR ANTONIO GOMES, 60 - MARIO ANDREAZZA",58112278,200Mbits
437,25094580,EEEF JOSE DE ALENCAR,João Pessoa,"RUA JOSE FERNANDES DINIZ, SN - OITIZEIRO",58087314,200Mbits
438,25003844,EEEFM JOAO SILVEIRA GUIMARAES,São Bento,"RUA SAO JUDAS TADEU, 53 - SAO JOSE",58865000,200Mbits
439,25068644,EEEF ANTENOR NAVARRO,Guarabira,"RUA PREFEITO MANOEL LORDAO, 161 - CENTRO",58200000,200Mbits
440,25087355,ECI EEM PROFESSOR RENATO FONSECA FILHO,Cuité de Mamanguape,"AVENIDA SEVERINO JORGE DE SENA, 980 - ",58289000,200Mbits
441,25089013,ECI JOSE PAULO DE FRANCA,Mari,"RUA LIDIO GALVAO, 76 - CENTRO",58345000,200Mbits
442,25096702,ECIT MARIA DO CARMO DE MIRANDA,João Pessoa,"RUA JOAO LUIZ RIBEIRO DE MORAIS, 279 - CENTRO",58013230,200Mbits
443,25126415,EEEFM TEREZA ALVES DE MOURA,Queimadas,"DISTRITO DE LIGEIRO, SN - ZONA RURAL",58475000,200Mbits
444,25049496,ECITE JOSE GONCALVES DE QUEIROZ,Sumé,"RUA PROFESSORA GUIOMAR COELHO, 201 - PEDREGAL",58540000,200Mbits
445,25093932,ECIT DAURA SANTIAGO RANGEL,João Pessoa,"RUA BENICIO DE OLIVEIRA LIMA, SN - JOSE AMERICO",58073030,200Mbits
446,25122533,ECI EEFM DOUTOR GUSTAVO FERNANDES DE LIMA SOBRINHO,Mamanguape,"RUA BENEDITO JOEL CORDEIRO, SN - AREAL",58280000,200Mbits
447,25091638,ECI IMACULADA CONCEICAO,Cabedelo,"RUA MARIZEIRO, SN - PORTAL DO POCO",58106106,200Mbits
448,25093843,ECI CONEGO FRANCISCO GOMES DE LIMA,João Pessoa,"RUA PETRONIO DE FIGUEIREDO, SN - GEISEL",58075410,200Mbits
449,25094106,ECI LUZIA SIMOES BARTOLLINI,João Pessoa,"RUA RADIALISTA GERALDO CAMPOS, SEM NUMERO - JARDIM PLANALTO",58088060,200Mbits
450,25015893,EEEFM ARRUDA CAMARA,Pombal,"MARGEM DA BR-230, SN - JARDIM ROGERIO",58840000,200Mbits
451,25036300,EEEFN GAMA E MELO,Princesa Isabel,"AVENIDA PRESIDENTE JOAO PESSOA, 460 - CENTRO",58755000,200Mbits
452,25091603,EEEFM PEDRO AMERICO,Cabedelo,"RUA PASTOR JOSE ALVES DE OLIVEIRA, 76 - CENTRO",58100222,200Mbits
453,25094777,EEEFM PROF DEBORA DUARTE,João Pessoa,"RUA ADRISIO MOTA DE SOUZA, 34 - FUNCIONARIOS II",58078030,200Mbits
454,25099256,ECI EEFM MARIA DE LOURDES ARAUJO,Santa Rita,"AV JOAO PESSOA, 188 - TIBIRI II",58302000,200Mbits
455,25007785,ECIT CRISTIANO CARTAXO,Cajazeiras,"AV JULIO MARQUES DO NASCIMENTO, 915 - JARDIM OASIS",58900000,200Mbits
456,25083490,ECI DEPUTADO CARLOS PESSOA FILHO,Aroeiras,"RUA TEREZA BARBOSA DE MOURA, 518 - CENTRO",58489000,200Mbits
457,25114506,EEEFM PROF JOSE BAPTISTA DE MELLO,João Pessoa,"RUA ADMINISTRADOR MANOEL ANGELO DE OLIVEIRA, SN - MANGABEIRA VII",58058200,200Mbits
458,25072242,EEEFM JOSE PINHEIRO,Campina Grande,"PRACA JOANA D ARC FERREIRA DE ARRUDA, 937 - JOSE PINHEIRO",58407382,200Mbits
